" |text просить устранить данный объект находиться ряд отдел полиция смотреть правоохранительный орган"
" |text контора расположиться забор детсад посититель разный состояние справлять нужда прям забор детсад свой вид порой пугать ребенок"
" |text кальянна стоить покерный стол пятница суббота играть деньга собираться просить провести проверка"
" |text ряд тц верона соседний здание зеленый дверь находиться игровой салон соседний дверь микрокредитный организация"
" |text видос просто сайдинга стоять игровой автомат"
" |text игровой автомат полиция бездействовать"
" |text смотреть полиция средь бел день работать игровой автомат выманивать деньга гражданин это прямой нарушение закон просить убрать автомат возле разливный напиток слева вход фото"
" |text игровой автомат автобусный остановка сююмбик сторона старое город красненький магазин название помнить"
" |text игровой автомат магазин продукт"
" |text игровой аппарат доступный играть ребенок пенсионер"
